id,category,tamil,translit,english,image
1,police,காவல் நிைலயம் எங்கு உள்ளது?,Kaval nilaiyam enku ullatu?,Where is the police station?,https://encrypted-tbn0.gstatic.com/images?q=tbn:ANd9GcR9b68nW3Tshk1V50IdnKD6Yg8NvtXNZK_kJCPOaUVjFvQnUN-hSiPBvGzVUIQ&s
2,police,நான் ஒரு ெகாள்ைளையப் புகாரளிக்க விரும்புகிேறன்,Nan oru kollaiyaip pukaralikka virumpukiren,I want to report a robbery.,https://encrypted-tbn0.gstatic.com/images?q=tbn:ANd9GcSVb0NO7lv2XBL2QYmAQd33Ak--PAKEO6gn89EuwIrtKkrZecGfAaY9SKf8eOk&s
3,police,அவன்/அவள் தாக்கப்பட்டுள்ளார்,Avan/aval takkappattullar,He/She has been assaulted.,https://encrypted-tbn0.gstatic.com/images?q=tbn:ANd9GcTIGqOftjlyMYdD18mN9i5MgI3tBVYZEVHbJ0eJ1C8zPis-t6hJmpSTSaPHkhg&s
4,police,எனது பணப்ைப திருடப்பட்டதா?,Enatu panappai tirutappattata?,My wallet was stolen?,https://encrypted-tbn0.gstatic.com/images?q=tbn:ANd9GcT274ZXM1mJ16auJSRjDH7FDkCiZ4whLbyqCBu-eIdv907qLdXfJwRMLdSgvA&s
5,police,நான் எனது …,Nan enatu …,I have lost my …,https://encrypted-tbn0.gstatic.com/images?q=tbn:ANd9GcQ3guj14AE8ZHVn4VX-b0-sG55dnydTD3T4vqx7FzgcGhEdqgRXHNv8BqcXfQ&s
6,police,நான் அவளால் தவறாக குற்றம் சாட்டப்பட்டிருக்கிேறன்,nan avalal tavaraka kurram cattappattirukkiren,I have been wrongly accused by her.,https://encrypted-tbn0.gstatic.com/images?q=tbn:ANd9GcSbBaBqjofifnhtZVquZdSIRpVkhOStWXrxRHg2QJ5KV09JDWLMKZqbfUSJU6g&s
7,police,நான் யாைரயாவது அைழக்கலாமா?,Nan yaraiyavatu alaikkalama?,Can I call someone?,https://encrypted-tbn0.gstatic.com/images?q=tbn:ANd9GcTqFfYH8M8uloIQ26S6yZMt6QF7-jagFiamdqYD_AojlmPFXUnyeonuT8V0GjQ&s
8,police,நான் எனது தூதரகத்ைத ெதாடர்பு ெகாள்ள விரும்புகிேறன்,Nan enatu tutarakattai totarpu kolla virumpukiren,I want to contact my embassy.,https://encrypted-tbn0.gstatic.com/images?q=tbn:ANd9GcT8uSrxL6e_mogHl4ilNnOccpKL-W6dPP9rt-pOWYS58DcrkwoEZXLwmei_i94&s
