id,category,tamil,translit,english
1,tickets,எங்ேக டிக்ெகட்கைள வாங்குவது?,Enke tikketkalai vankuvatu?,Where can I buy a ticket?
2,tickets,நான் முன்கூட்டிேய டிக்ெகட் பதிவு ெசய்ய ேவண்டுமா?,Nan munkuttiye tikket pativu ceyya ventuma?,Do I need to book a ticket in advance?
3,tickets,எனக்கு ஒரு வழி / திரும்ப டிக்ெகட் கிைடக்குமா?,Enakku oru vali/ tirumpa tikket kitaikkuma?,"Can I have a one-way / return ticket, please?"
4,tickets,நான் 1ஆம் வகுப்பு / 2ஆம் வகுப்பு டிக்ெகட்ைடப் ெபற முடியுமா … ?,Nan 1am vakuppu/ 2am vakuppu tikkettaip pera mutiyuma … ?,Can I have 1st-class / 2nd-class ticket to … ?
5,tickets,நான் ஒரு நாள் / வாராந்திர டிக்ெகட் ெபறலாமா?,Nan oru nal/ varantira tikket peralama?,Can I get a day / weekly ticket?
6,tickets,டிக்ெகட்ைட ரத்து ெசய்ய / மாற்ற / உறுதிப்படுத்த விரும்புகிேறன்,Tikkettai rattu ceyya/ marra/ urutippatutta virumpukiren,"I would like to cancel / change / confirm my ticket, please."
